Global_ID	Database_Source	Search_Date	Record_ID_in_DB	Title	Authors	Year	DOI	Link_URL	Type	Record_Status	Duplicate_Group_I	Duplicate_Removal_Reason	Included_in_Unique_Set	Stage_1_R1	Stage_1_R2	Stage_1_Conflict	Stage_1_FinalDecision	Stage_1_Notes	Stage_2_FullText_Available	Stage_2_R1	Stage_2_R2	Stage_2_Conflict	Stage_2_FinalDecision	ExclusionReasonCode	ExclusionReasonDetail	FullText_FilePath	QA1	QA2	QA3	QA4	QA5	QA6	QA7	QA8	QA9	QA10	QA_Total	QA_Average	QA_IncludeFlag	Final_Inclusion_Status	Reason_if_Excluded	Notes
324	Wiley	25-10-2025	324	Cross-Project Defect Prediction Using Transfer Learning with Long Short-Term Memory Networks	Tao H,Fu L,Cao Q,Niu X,Chen H,Shang S,Xian Y	2024	10.1049/2024/5550801	http://dx.doi.org/10.1049/2024/5550801;https://onlinelibrary.wiley.com/doi/abs/10.1049/2024/5550801	Journal	unique			1	1	1	0	1		1	1	1	0	1																	1		
325	Wiley	25-10-2025	325	Defect Prediction Technology of Aerospace Software Based on Deep Neural Network and Process Measurement	Yao T,Zhang B,Peng J,Han Z,Yang Z,Zhang Z,Zhang B	2022	10.1155/2022/1276830	http://dx.doi.org/10.1155/2022/1276830;https://onlinelibrary.wiley.com/doi/abs/10.1155/2022/1276830	Journal	unique			1	0	0	0	0							E3																		
326	Wiley	25-10-2025	326	IC-GraF: An Improved Clustering with Graph-Embedding-Based Features for Software Defect Prediction	Wang X,Lu L,Tian Q,Lin H	2024	10.1049/2024/8027037	http://dx.doi.org/10.1049/2024/8027037;https://onlinelibrary.wiley.com/doi/abs/10.1049/2024/8027037	Journal	unique			1	1	1	0	1		1	1	1	0	1																	1		
327	Wiley	25-10-2025	327	Software defect prediction based on stacked sparse denoising autoencoders and enhanced extreme learning machine	Zhang N,Ying S,Zhu K,Zhu D	2021	10.1049/sfw2.12029	http://dx.doi.org/10.1049/sfw2.12029;https://onlinelibrary.wiley.com/doi/abs/10.1049/sfw2.12029	Journal	unique			1	1	1	0	1		1	1	1	0	1																	1		
328	Wiley	25-10-2025	328	Improved mayfly optimization deep stacked sparse auto encoder feature selection scorched gradient descent driven dropout XLM learning framework for software defect prediction	Anbu M	2022	10.1002/cpe.7240	http://dx.doi.org/10.1002/cpe.7240;https://onlinelibrary.wiley.com/doi/abs/10.1002/cpe.7240	Journal	unique	35		1	1	1	0	1		1	1	1	0	1																	1		
329	Wiley	25-10-2025	329	Software Defect Prediction Using Deep Q-Learning Network-Based Feature Extraction	Zhang Q,Zhang J,Feng T,Xue J,Zhu X,Zhu N,Li Z	2024	10.1049/2024/3946655	http://dx.doi.org/10.1049/2024/3946655;https://onlinelibrary.wiley.com/doi/abs/10.1049/2024/3946655	Book	unique			1	1	1	0	1		1	1	1	0	1																	1		
330	Wiley	25-10-2025	330	Machine Learning Approaches for Software Defect Prediction	Zaidi HZ,Ullah U,Arshad M,Aljuaid H,Rauf MA,Sarwar N,Sajid R	2025	10.1155/acis/7933078	http://dx.doi.org/10.1155/acis/7933078;https://onlinelibrary.wiley.com/doi/abs/10.1155/acis/7933078	Journal	duplicate	34		0																													
331	GoogleScholar	25-10-2025	331	A survey on software defect prediction using deep learning	EN Akimova, AY Bersenev, AA Deikov, KS Kobylkin…	2021		https://www.mdpi.com/2227-7390/9/11/1180		unique			1	0	0	0	0							E2																		
332	GoogleScholar	25-10-2025	332	Deeplinedp: Towards a deep learning approach for line-level defect prediction	C Pornprasit…	2022			Journal	duplicate	51		0																													
333	GoogleScholar	25-10-2025	333	On the use of deep learning in software defect prediction	G Giray, KE Bennin, Ö Köksal, Ö Babur…	2023		https://www.sciencedirect.com/science/article/pii/S0164121222002138		duplicate	3	Identical title, same year, different database	0																													
334	GoogleScholar	25-10-2025	334	Application of deep learning in software defect prediction: systematic literature review and meta-analysis	ZM Zain, S Sakri, NHA Ismail	2023				duplicate	4	Identical title, same year, different database	0																													
335	GoogleScholar	25-10-2025	335	Deep learning for software defect prediction: A survey	S Omri, C Sinz	2020	10.1145/3387940.3391463	https://www.academia.edu/download/80883408/2020-Omri-DeepTest.pdf		duplicate	48		0																													
336	GoogleScholar	25-10-2025	336	Deep learning based software defect prediction	L Qiao, X Li, Q Umer, P Guo	2020		https://www.academia.edu/download/94397177/j.neucom.2019.11.06720221117-1-7ljqcj.pdf	Journal	duplicate	46		0																													
337	GoogleScholar	25-10-2025	337	DeepCPDP: Deep learning based cross-project defect prediction	D Chen, X Chen, H Li, J Xie, Y Mu	2019		https://ieeexplore.ieee.org/iel7/6287639/6514899/08937501.pdf	Journal	duplicate	49		0																													
338	GoogleScholar	25-10-2025	338	Deepjit: an end-to-end deep learning framework for just-in-time defect prediction	T Hoang, HK Dam, Y Kamei, D Lo…	2019		https://ink.library.smu.edu.sg/cgi/viewcontent.cgi?article=5489&context=sis_research		duplicate	50		0																													
339	GoogleScholar	25-10-2025	339	Software defect prediction using deep learning	M Nevendra, P Singh	2021		http://epa.niif.hu/02400/02461/00115/pdf/EPA02461_acta_polytechnica_2021_10_173-189.pdf	Journal	unique			1	1	1	0	1		1	1	1	0	1																	1		
340	GoogleScholar	25-10-2025	340	A survey of software defect prediction based on deep learning	M Nevendra, P Singh	2022	10.1007/s11831-022-09787-8	https://www.researchgate.net/profile/Meetesh-Nevendra/publication/362415525_A_Survey_of_Software_Defect_Prediction_Based_on_Deep_Learning/links/6631e5647091b94e93e9df0d/A-Survey-of-Software-Defect-Prediction-Based-on-Deep-Learning.pdf		duplicate	5	Identical title, same year, different database	0																													
341	GoogleScholar	25-10-2025	341	Software defect prediction based on deep learning models: Performance study	A Hasanpour, P Farzi, A Tehrani, R Akbari	2020		https://arxiv.org/pdf/2004.02589		unique			1	0	0	0	0							E9																		
342	GoogleScholar	25-10-2025	342	Is deep learning good enough for software defect prediction?	SK Pandey, A Haldar, AK Tripathi	2025	10.1007/s11334-023-00542-1			duplicate	6	Same DOI	0																													
343	GoogleScholar	25-10-2025	343	A deep learning framework for simulation and defect prediction applied in microelectronics	N Dimitriou, L Leontaris, T Vafeiadis, D Ioannidis…	2020		https://arxiv.org/pdf/2002.10986		unique			1	0	0	0	0							E3																		
344	GoogleScholar	25-10-2025	344	Deep learning-based defect prediction for mobile applications	M Jorayeva, A Akbulut, C Catal, A Mishra	2022		https://www.mdpi.com/1424-8220/22/13/4734	Journal	unique			1	1	1	0	1		1	1	1	0	1																	1		
345	GoogleScholar	25-10-2025	345	SLDeep: Statement-level software defect prediction using deep-learning model on static code features	A Majd, M Vahidi-Asl, A Khalilian…	2020		https://faculty.utrgv.edu/dongchul.kim/6379/t6.pdf	Journal	duplicate	58		0																													
346	GoogleScholar	25-10-2025	346	Semantic and traditional feature fusion for software defect prediction using hybrid deep learning model	A Abdu, Z Zhai, HA Abdo, R Algabri, MA Al-Masni…	2024		https://www.nature.com/articles/s41598-024-65639-4	Journal	duplicate	57		0																													
347	GoogleScholar	25-10-2025	347	On the value of oversampling for deep learning in software defect prediction	R Yedida, T Menzies	2021		https://arxiv.org/pdf/2008.03835	Journal	duplicate	7	Identical title, same year, different database	0																													
348	GoogleScholar	25-10-2025	348	Deep learning-based software defect prediction via semantic key features of source code—systematic survey	A Abdu, Z Zhai, R Algabri, HA Abdo, K Hamad…	2022		https://www.mdpi.com/2227-7390/10/17/3120		unique			1	0	0	0	0							E2																		
349	GoogleScholar	25-10-2025	349	Software defect prediction based on machine learning and deep learning	P Tadapaneni, NC Nadella, M Divyanjali…	2022				duplicate	8	Identical title, same year, different database	0																													
350	GoogleScholar	25-10-2025	350	Deep semantic feature learning for software defect prediction	S Wang, T Liu, J Nam, L Tan	2018		https://www.eecs.yorku.ca/~wangsong/papers/tse18.pdf		duplicate	9	Identical title, same year, different database	0																													
351	GoogleScholar	25-10-2025	351	Software defect prediction using dimensionality reduction and deep learning	M Massoudi, NK Jain, P Bansal	2021				duplicate	10	Identical title, same year, different database	0																													
352	GoogleScholar	25-10-2025	352	Defect prediction using deep learning with Network Portrait Divergence for software evolution	V Walunj, G Gharibi, R Alanazi, Y Lee	2022	10.1007/s10664-022-10147-0	https://par.nsf.gov/servlets/purl/10341954		duplicate	11	Identical title, same year, different database	0																													
353	GoogleScholar	25-10-2025	353	Lineflowdp: A deep learning-based two-phase approach for line-level defect prediction	F Yang, F Zhong, G Zeng, P Xiao, W Zheng	2024	10.1007/s10664-023-10439-z		Journal	duplicate	54		0																													
354	GoogleScholar	25-10-2025	354	A model based on program slice and deep learning for software defect prediction	J Tian, Y Tian	2020				duplicate	12	Identical title, same year, different database	0																													
355	GoogleScholar	25-10-2025	355	A cross-project defect prediction model based on deep learning with self-attention	W Wen, R Zhang, C Wang, C Shen, M Yu…	2022		https://ieeexplore.ieee.org/iel7/6287639/6514899/09919153.pdf	Journal	unique			1	1	1	0	1		1	1	1	0	1																	1		
356	GoogleScholar	25-10-2025	356	Software defect prediction via deep learning	RU Khan, S Albahli, W Albattah…	2020		https://www.academia.edu/download/76602031/D1858029420.pdf	Journal	unique			1	1	1	0	1		1	0	0	0	0	E6																0		
357	GoogleScholar	25-10-2025	357	Deep learning software defect prediction methods for cloud environments research	W Liu, B Wang, W Wang	2021	10.1155/2021/2323100	https://onlinelibrary.wiley.com/doi/pdf/10.1155/2021/2323100		duplicate	13	Identical title, same year, different database	0																													
358	GoogleScholar	25-10-2025	358	A deep learning framework for defect prediction based on thermographic in-situ monitoring in laser powder bed fusion	S Oster, PP Breese, A Ulbricht, G Mohr…	2024	10.1007/s10845-023-02117-0	https://link.springer.com/article/10.1007/s10845-023-02117-0		unique			1	0	0	0	0							E3																		
359	GoogleScholar	25-10-2025	359	Software Defect Prediction Based on Machine Learning and Deep Learning Techniques: An Empirical Approach	W Albattah, M Alzahrani	2024		https://www.mdpi.com/2673-2688/5/4/86	Journal	unique			1	1	1	0	1		1	1	1	0	1																	1		
360	GoogleScholar	25-10-2025	360	Software defect prediction based on hybrid swarm intelligence and deep learning	Z Li, T Li, YM Wu, L Yang, H Miao…	2021	10.1155/2021/4997459	https://onlinelibrary.wiley.com/doi/pdf/10.1155/2021/4997459	Journal	unique			1	1	1	0	1		1	1	1	0	1																	1		
361	GoogleScholar	25-10-2025	361	Just-in-time defect prediction for mobile applications: using shallow or deep learning?	R van Dinter, C Catal, G Giray, B Tekinerdogan	2023	10.1007/s11219-023-09629-1	https://link.springer.com/article/10.1007/s11219-023-09629-1		duplicate	53		0																													
362	GoogleScholar	25-10-2025	362	Software visualization and deep transfer learning for effective software defect prediction	J Chen, K Hu, Y Yu, Z Chen, Q Xuan, Y Liu…	2020	10.1145/3377811.3380389	https://web.cs.ucdavis.edu/~filkov/papers/DTLDP_ICSE2020.pdf		duplicate	1	Identical title, same year, different database	0																													
363	GoogleScholar	25-10-2025	363	Software defect prediction model based on deep learning	Y Zhang	2024			Conference	duplicate	14	Identical title, same year, different database	0																													
364	GoogleScholar	25-10-2025	364	Cross-Project Defect Prediction via Transferable Deep Learning-Generated and Handcrafted Features.	S Qiu, L Lu, Z Cai, S Jiang	2019		http://ksiresearch.org/seke/seke19paper/seke19paper_70.pdf	Journal	unique			1	1	1	0	1		1	1	1	0	1																	1		
365	GoogleScholar	25-10-2025	365	Unifying defect prediction, categorization, and repair by multi-task deep learning	C Ni, K Yang, Y Zhu, X Chen…	2023			Conference	unique			1	1	1	0	0							E3																		
366	GoogleScholar	25-10-2025	366	Deep learning based continuous integration and continuous delivery software defect prediction with effective optimization strategy	A Mishra, A Sharma	2024				duplicate	15	Identical title, same year, different database	0																													
367	GoogleScholar	25-10-2025	367	Just-in-time defect prediction for Android apps via imbalanced deep learning model	K Zhao, Z Xu, M Yan, Y Tang, M Fan…	2021	10.1145/3412841.3442019	https://drive.google.com/file/d/1iIcLOkZBL5T70G8sDh3nA2q-pa78m2Dh/view		unique			1	0	0	0	0							E3																		
368	GoogleScholar	25-10-2025	368	A deep learning based model for defect prediction in intra-project software	K Sekaran, LSP Annabel	2023				duplicate	16	Identical title, same year, different database	0																													
369	GoogleScholar	25-10-2025	369	A hierarchical feature ensemble deep learning approach for software defect prediction	S Zhang, S Jiang, Y Yan	2023	10.1142/S0218194023500079		Journal	unique			1	1	1	0	1		0	0	0	0	0	E5																		
370	GoogleScholar	25-10-2025	370	Software Defect Prediction Based on Non-Linear Manifold Learning and Hybrid Deep Learning Techniques	K Zhu, N Zhang, Q Zhang, S Ying…	2020		https://cdn.techscience.press/uploads/attached/file/20200820/20200820031415_80035.pdf	Journal	unique			1	1	1	0	1		1	1	1	0	1																	1		
371	GoogleScholar	25-10-2025	371	IMDAC: A robust intelligent software defect prediction model via multi-objective optimization and end-to-end hybrid deep learning networks	K Zhu, N Zhang, C Jiang, D Zhu	2024	10.1002/spe.3274			duplicate	17	Same DOI	0																													
372	GoogleScholar	25-10-2025	372	Nested deep learning with learned network embeddings for software defect prediction	S Mehta, L Kumar, S Misra, KS Patnaik, V Singh	2025		https://www.sciencedirect.com/science/article/pii/S1568494625003680	Journal	duplicate	18	Identical title, same year, different database	0																													
373	GoogleScholar	25-10-2025	373	Software defect density prediction using deep learning	F Alghanim, M Azzeh, A El-Hassan, H Qattous	2022		https://ieeexplore.ieee.org/iel7/6287639/6514899/09931128.pdf		duplicate	36		0																													
374	GoogleScholar	25-10-2025	374	Deep learning or classical machine learning? An empirical study on line‐level software defect prediction	Y Zhou, X Liu, Z Guo, Y Zhou…	2024	10.1002/smr.2696		Journal	duplicate	19	Same DOI	0																													
375	GoogleScholar	25-10-2025	375	Combining deep learning and kernel PCA for software defect prediction	A Ho, N Nhat Hai, B Thi-Mai-Anh	2022	10.1145/3568562.3568587		Conference	duplicate	45		0																													
376	GoogleScholar	25-10-2025	376	Bridging expert knowledge with deep learning techniques for just-in-time defect prediction	X Zhou, DG Han, D Lo	2025	10.1007/s10664-024-10591-0	https://arxiv.org/pdf/2403.11079		duplicate	60		0																													
377	GoogleScholar	25-10-2025	377	Cross project defect prediction using deep learning techniques	MP Sasankar, G Sakarkar	2022		https://ijecs.net/publish/30_9892_70N.pdf	Journal	unique			1	1	1	0	1		1	0	0	0	0	E6																0		
378	GoogleScholar	25-10-2025	378	Just-in-time defect prediction for self-driving software via a deep learning model	J Choi, T Kim, D Ryu, J Baik…	2023		https://ieeexplore.ieee.org/iel7/10243554/10243559/10243560.pdf		duplicate	20	Identical title, same year, different database	0																													
379	GoogleScholar	25-10-2025	379	TRGNet: a deep transfer learning approach for software defect prediction	M Nevendra, P Singh	2025				duplicate	21	Identical title, same year, different database	0																													
380	GoogleScholar	25-10-2025	380	Research on software defect prediction technology based on deep learning	P Jiang	2021				duplicate	22	Identical title, same year, different database	0																													
381	GoogleScholar	25-10-2025	381	An Empirical Systematic Study of Deep Learning-Based Software Defect Prediction Models in Complex Systems	Z Shen	2024				duplicate	23	Identical title, same year, different database	0																													
382	GoogleScholar	25-10-2025	382	Deep semantic feature learning with embedded static metrics for software defect prediction	G Fan, X Diao, H Yu, K Yang…	2019			Conference	unique			1	1	1	0	1		1	1	1	0	1																	1		
383	GoogleScholar	25-10-2025	383	Revolutionizing Software Defect Prediction Through Deep Learning	J Charles	2024				duplicate	24	Identical title, same year, different database	0																													
384	GoogleScholar	25-10-2025	384	Studying the effectiveness of deep active learning in software defect prediction	F Feyzi, A Daneshdoost	2023	10.1080/1206212X.2023.2252117		Journal	unique			1	1	1	0	1		1	1	1	0	1																	1		
385	GoogleScholar	25-10-2025	385	LDFR: Learning deep feature representation for software defect prediction	Z Xu, S Li, J Xu, J Liu, X Luo, Y Zhang, T Zhang…	2019		https://www4.comp.polyu.edu.hk/~csxluo/LDFR.pdf	Journal	unique			1	1	1	0	1		1	1	1	0	1																	1		
386	GoogleScholar	25-10-2025	386	Development of edge-based deep learning prediction model for defect prediction in manufacturing process	KT Lee, YS Lee, H Yoon	2019				unique			1	0	0	0	0							E3																		
387	GoogleScholar	25-10-2025	387	Source code-based defect prediction using deep learning and transfer learning	AA Saifan, N Al Smadi	2019	10.3233/IDA-184297		Journal	unique			1	1	1	0	1		0	0	0	0	0	E5																		
388	GoogleScholar	25-10-2025	388	Clone consistent-defect prediction based on deep learning method	F Zhang, Y Che, T Liang, W Jiang	2023				duplicate	44		0																													
389	GoogleScholar	25-10-2025	389	Hybrid deep learning approach for software defect prediction: Diffusion kernel attention and gudermannian networks	S PS, M Lokhande, R Jothilakshmi…	2025	10.1177/02666669251342553		Journal	unique			1	1	1	0	1		0	0	0	0	0	E5																		
390	GoogleScholar	25-10-2025	390	Cross Project Defect Prediction using Dropout Regularized Deep Learning and Unique Matched Metrics	PR Bal, S Kumar	2025	10.1145/3698109	https://dl.acm.org/doi/pdf/10.1145/3698109	Journal	duplicate	25	Identical title, same year, different database	0																													
391	GoogleScholar	25-10-2025	391	Software defect prediction based on deep representation learning of source code from contextual syntax and semantic graph	A Abdu, Z Zhai, HA Abdo…	2024			Journal	unique			1	1	1	0	1		1	1	1	0	1																	1		
392	GoogleScholar	25-10-2025	392	Performing Software Defect Prediction Using Deep Learning	S Gurung	2021	10.1007/978-3-031-22405-8_25		Conference	duplicate	55		0																													
393	GoogleScholar	25-10-2025	393	Deep learning experiments with skewed data for defect prediction in plastic injection molding	S Kim, S Kim, KR Ryu	2018				unique			1	0	0	0	0							E3																		
394	GoogleScholar	25-10-2025	394	Using a deep learning tool for software defect prediction in new application development	E Syyrilä	2023		https://lutpub.lut.fi/bitstream/handle/10024/166255/Thesis_Elias_Syyril%C3%A4.pdf?sequence=1&isAllowed=y		unique			1	0	0	0	0							E3																		
395	GoogleScholar	25-10-2025	395	A novel attention based deep learning model for software defect prediction with bidirectional word embedding system	MC Devi, TD Rajkumar	2025	10.1007/s00500-025-10475-5		Journal	duplicate	26	Identical title, same year, different database	0																													
396	GoogleScholar	25-10-2025	396	A deep ensemble learning method for effort-aware just-in-time defect prediction	S Albahli	2019		https://www.mdpi.com/1999-5903/11/12/246		unique	37		1	0	0	0	0							E3																		
397	GoogleScholar	25-10-2025	397	An Empirical Comparison of Resampling Ensemble Methods of Deep Learning Neural Networks for Cross-Project Software Defect Prediction.	MO Elish, K Elish	2021		https://inass.org/wp-content/uploads/2021/06/2021063018.pdf	Journal	unique			1	1	1	0	1		1	0	0	0	0	E6																0		
398	GoogleScholar	25-10-2025	398	Just-In-Time Software Defect Prediction using a deep learning-based model	RA Dos Santos	2024		https://journals.vilniustech.lt/index.php/NTCS/article/download/22274/12700/		unique			1	0	0	0	0							E3																		
399	GoogleScholar	25-10-2025	399	Software defect prediction method based on rgb image and deep learning	XG Yang, Z Li, T Li, WJ Chu…	2023				duplicate	27	Identical title, same year, different database	0																													
400	GoogleScholar	25-10-2025	400	Accuracy Prediction of Ensemble Deep Learning Model through Software Defect Prediction	S Charan, S Sinha, SM Sujan…	2024				duplicate	28	Identical title, same year, different database	0																													
401	GoogleScholar	25-10-2025	401	Research on Efficient Software Defect Prediction Using Deep Learning Approaches	A Oberoi, A Vats, A Sivasangari…	2022				duplicate	29	Identical title, same year, different database	0																													
402	GoogleScholar	25-10-2025	402	A Software Defect Prediction Method Using a Multivariate Heterogeneous Hybrid Deep Learning Algorithm	Q Fei, H Hu, G Yin, Z Sun	2025		https://cdn.techscience.press/files/cmc/2025/TSP_CMC-82-2/TSP_CMC_58931/TSP_CMC_58931.pdf	Journal	duplicate	38		0																													
403	GoogleScholar	25-10-2025	403	Research on software defect prediction system based on deep learning	W Wu, C Feng, H Ren, X Han…	2022	10.1117/12.2660800.short		Conference	unique			1	1	1	0	1		0	0	0	0	0	E5																		
404	GoogleScholar	25-10-2025	404	Enhancing cross-project just-in-time defect prediction with active deep learning	Y Wang, Y Li, Y Ren, J Yu	2023				duplicate	52		0																													
405	GoogleScholar	25-10-2025	405	A study of applying deep learning-based weighted combinations to improve defect prediction accuracy and effectiveness	CY Huang, C Huang, MC Yang…	2019			Conference	duplicate	39		0																													
406	GoogleScholar	25-10-2025	406	Deep Learning-Based Defect Prediction for Mobile Apps	M Jorayeva	2022		http://openaccess.iku.edu.tr/bitstreams/e56fdc7b-f1fd-48e8-ad50-0ae52e4ba5c2/download	Journal	unique			1	1	1	0	1		0	0	0	0	0	E5																		
407	GoogleScholar	25-10-2025	407	Multi-Dimensional Software Defect Prediction using Ensemble and Deep Learning	S Abhichandani	2025			Conference	duplicate	30	Identical title, same year, different database	0																													
408	GoogleScholar	25-10-2025	408	Software defect prediction using deep semantic feature learning	B Dwarakanath, S Renuka, TV Brindha…	2023				duplicate	31	Identical title, same year, different database	0																													
409	GoogleScholar	25-10-2025	409	Surface defect prediction on printed circuit boards using a novel deep learning model with spatial and channel attention-based DenseNet	MS Samuthiram, RSM Vanamamalai	2025	10.1007/s00202-024-02737-6			unique			1	0	0	0	0							E3																		
410	GoogleScholar	25-10-2025	410	Software Defect Prediction Model based on AST and Deep Learning	Z Ye, C Yu, Z Lu	2025		https://scpe.org/index.php/scpe/article/view/4910/1571	Journal	unique			1	1	1	0	1		1	1	1	0	1																	1		
411	GoogleScholar	25-10-2025	411	Toward reduction in false positives just-in-time software defect prediction using deep reinforcement learning	AM Ismail, SH Ab Hamid, AA Sani, NNM Daud	2024		https://ieeexplore.ieee.org/iel7/6287639/6514899/10485281.pdf		unique			1	0	0	0	0							E3																		
412	GoogleScholar	25-10-2025	412	An optimized deep learning method for software defect prediction using Whale Optimization Algorithm	AA Aihong, BI Ya'U, U Ali, A Ahmad…	2024		https://cyberleninka.ru/article/n/an-optimized-deep-learning-method-for-software-defect-prediction-using-whale-optimization-algorithm	Journal	unique	40		1	1	1	0	1		1	1	1	0	1																	1		
413	GoogleScholar	25-10-2025	413	Deep learning-based multisensor fusion for in situ defect prediction in additive manufacturing	G Xie, J Walker, J Middendorf, T Spears…	2025	10.1117/12.3063312.short			unique			1	0	0	0	0							E3																		
414	GoogleScholar	25-10-2025	414	A software defect prediction approach by cat hunting optimization (CHO) algorithm and deep learning based on the GAN-VGG16 networks	A Ghaedi, A Khatibi Bardsiri…	2023		https://papers.ssrn.com/sol3/Delivery.cfm?abstractid=4548638		unique			1	1	1	0	1		0	0	0	0	0	E5																		
415	GoogleScholar	25-10-2025	415	Deep Learning-Based Automated Software Defect Prediction Model	J Fan, H Chen	2024				duplicate	32	Identical title, same year, different database	0																													
416	GoogleScholar	25-10-2025	416	Beyond Machine Learning: Exploring Deep Learning and Transformers for Software Defect Prediction	L Dhawan, A Bansal	2024	10.1007/978-981-96-3372-2_7			duplicate	43		0																													
417	GoogleScholar	25-10-2025	417	Deep Learning for Software Defect Prediction in time	M Yadav, V Singh, P Rastogi	2018		https://www.researchgate.net/profile/Vijendra-Singh-7/publication/334080551_Deep_Learning_for_Software_Defect_Prediction_in_time/links/5f7ff494a6fdccfd7b51ddea/Deep-Learning-for-Software-Defect-Prediction-in-time.pdf		duplicate	47		0																													
