"Item type","Authors","Title","Journal","Publication year","Volume","Issue","Pages","Publisher","Book title","Date published","ISBN","URLs","DOI","Abstract","Keywords","Notes","Eprint ID","Chapter"
"Journal Article","Yao T,Zhang B,Peng J,Han Z,Yang Z,Zhang Z,Zhang B","Defect Prediction Technology of Aerospace Software Based on Deep Neural Network and Process Measurement","Mathematical Problems in Engineering","2022","2022","1","1276830","","","2022","","http://dx.doi.org/10.1155/2022/1276830;https://onlinelibrary.wiley.com/doi/abs/10.1155/2022/1276830","10.1155/2022/1276830","In order to ensure high reliability, the efficiency of traditional aerospace software testing is often low. With the rapid development of machine learning, its powerful data feature extraction ability has great potential in improving the efficiency of aerospace software testing. Therefore, this paper proposed a software defect prediction method based on deep neural network and process measurement. Based on the NASA data set and combined with the software process data, the software defect measurement set is constructed. 35 measurement elements are used as the original input, and multiple single-layer automatic coding networks are superimposed to form the deep neural network model of software defect. The model is finally trained by the layer-by-layer greedy training method to realize software defect prediction. Experimental verification shows that the prediction method has a good prediction effect on aerospace software defects, and the accuracy rate reached 90%, which can greatly improve the efficiency and effect of aerospace software testing.","","","https://onlinelibrary.wiley.com/doi/pdf/10.1155/2022/1276830",""
"Journal Article","Wang X,Lu L,Tian Q,Lin H","IC-GraF: An Improved Clustering with Graph-Embedding-Based Features for Software Defect Prediction","IET Software","2024","2024","1","8027037","","","2024","","http://dx.doi.org/10.1049/2024/8027037;https://onlinelibrary.wiley.com/doi/abs/10.1049/2024/8027037","10.1049/2024/8027037","Software defect prediction (SDP) has been a prominent area of research in software engineering. Previous SDP methods often struggled in industrial applications, primarily due to the need for sufficient historical data. Thus, clustering-based unsupervised defect prediction (CUDP) and cross-project defect prediction (CPDP) emerged to address this challenge. However, the former exhibited limitations in capturing semantic and structural features, while the latter encountered constraints due to differences in data distribution across projects. Therefore, we introduce a novel framework called improved clustering with graph-embedding-based features (IC-GraF) for SDP without the reliance on historical data. First, a preprocessing operation is performed to extract program dependence graphs (PDGs) and mark distinct dependency relationships within them. Second, the improved deep graph infomax (IDGI) model, an extension of the DGI model specifically for SDP, is designed to generate graph-level representations of PDGs. Finally, a heuristic-based k-means clustering algorithm is employed to classify the features generated by IDGI. To validate the efficacy of IC-GraF, we conduct experiments based on 24 releases of the PROMISE dataset, using F-measure and G-measure as evaluation criteria. The findings indicate that IC-GraF achieves 5.0%−42.7% higher F-measure, 5%−39.4% higher G-measure, and 2.5%−11.4% higher AUC over existing CUDP methods. Even when compared with eight supervised learning-based SDP methods, IC-GraF maintains a superior competitive edge.","","","https://onlinelibrary.wiley.com/doi/pdf/10.1049/2024/8027037",""
"Journal Article","Zhang N,Ying S,Zhu K,Zhu D","Software defect prediction based on stacked sparse denoising autoencoders and enhanced extreme learning machine","IET Software","2022","16","1","29-47","","","2022","","http://dx.doi.org/10.1049/sfw2.12029;https://onlinelibrary.wiley.com/doi/abs/10.1049/sfw2.12029","10.1049/sfw2.12029","Abstract Software defect prediction is an important software quality assurance technique. Nevertheless, the prediction performance of the constructed model is easily susceptible to irrelevant or redundant features in the software projects and is not predominant enough. To address these two issues, a novel defect prediction model called SSEPG based on Stacked Sparse Denoising AutoEncoders (SSDAE) and Extreme Learning Maching (ELM) optimised by Particle Swarm Optimisation (PSO) and another complementary Gravitational Search Algorithm (GSA) are proposed in this paper, which has two main merits: (1) employ a novel deep neural network – SSDAE to extract new combined features, which can effectively learn the robust deep semantic feature representation. (2) integrate strong exploitation capacity of PSO with strong exploration capability of GSA to optimise the input weights and hidden layer biases of ELM, and utilise the superior discriminability of the enhanced ELM to predict the defective modules. The SSDAE is compared with eleven state-of-the-art feature extraction methods in effect and efficiency, and the SSEPG model is compared with multiple baseline models that contain five classic defect predictors and three variants across 24 software defect projects. The experimental results exhibit the superiority of the SSDAE and the SSEPG on six evaluation metrics.","software reliability, image denoising, feature extraction, learning (artificial intelligence), particle swarm optimisation, search problems, neural nets, software maintenance, software quality","","https://onlinelibrary.wiley.com/doi/pdf/10.1049/sfw2.12029",""
"Journal Article","Anbu M","Improved mayfly optimization deep stacked sparse auto encoder feature selection scorched gradient descent driven dropout XLM learning framework for software defect prediction","Concurrency and Computation: Practice and Experience","2022","34","25","e7240","","","2022","","http://dx.doi.org/10.1002/cpe.7240;https://onlinelibrary.wiley.com/doi/abs/10.1002/cpe.7240","10.1002/cpe.7240","Summary Software testing is the process of improving software quality by classifying and removing defects in the software development. Previously, several methods were used for software defect prediction, but any one method did not provide sufficient accuracy. To overcome this issue, an improved may fly optimization with deep stacked sparse auto encoder feature selection scorched gradient descent driven dropout extreme learning machine framework (SDP-IMFOFS-GDDDXLMC) is proposed in this article for software defect prediction. Here, an IMFO method is considered for feature selection techniques. In feature selection technique, features are selected, such as PC1, PC4, and MC1 for selecting the probable minimal attribute. Then, GDDDXLMC approach is used to classify buggy and clean software detection. The proposed approach is implemented in MATLAB platform. The performance metrics, such as accuracy, precision, F-measure, sensitivity, specificity, Mathew correlation coefficient (MCC) is examined to examine the performance of the proposed method. The simulation performance of the proposed SDP-IMFOFS-GDDDXLMC method attains higher accuracy 99.75%, 97.85%, 95.13%, 14.89%, 16.34%, 17.89%, and 98.79, higher sensitivity 96.34%, 91.23%, 89.12%, 12.67%, 17.56%, 18.90%, and 87.25% higher specificity 14.89%, 16.89%, 20.67%, 93.67%, 92.37%, 98.47%, and 94.78% compared with the existing methods, like SDP-MLP-PSO, SDP-BPNN-RBFNN, SDP-CNN-RNN-LSTM, SDP-KBN-LIME, SDP-SLDeep-LSTM, SDP-K-PCA-ELM, and SDP-CNN-PHI forest, respectively.","feature selection, gradient descent driven dropout XLM learning, improved may fly optimization, software defect prediction","","https://onlinelibrary.wiley.com/doi/pdf/10.1002/cpe.7240",""
"Book Chapter","Zhang Q,Zhang J,Feng T,Xue J,Zhu X,Zhu N,Li Z","Software Defect Prediction Using Deep Q-Learning Network-Based Feature Extraction","","2024","2024","","3946655","John Wiley & Sons, Ltd","Fundamentals and Methods of Machine and Deep Learning","2024","9781119821908","http://dx.doi.org/10.1049/2024/3946655;https://onlinelibrary.wiley.com/doi/abs/10.1049/2024/3946655","10.1049/2024/3946655","Machine learning-based software defect prediction (SDP) approaches have been commonly proposed to help to deliver high-quality software. Unfortunately, all the previous research conducted without effective feature reduction suffers from high-dimensional data, leading to unsatisfactory prediction performance measures. Moreover, without proper feature reduction, the interpretability and generalization ability of machine learning models in SDP may be compromised, hindering their practical utility in diverse software development environments. In this paper, an SDP approach using deep Q-learning network (DQN)-based feature extraction is proposed to eliminate irrelevant, redundant, and noisy features and improve the classification performance. In the data preprocessing phase, the undersampling method of BalanceCascade is applied to divide the original datasets. As the first step of feature extraction, the weight ranking of all the metric elements is calculated according to the expected cross-entropy. Then, the relation matrix is constructed by applying random matrix theory. After that, the reward principle is defined for computing the Q value of Q-learning based on weight ranking, relation matrix, and the number of errors, according to which a convolutional neural network model is trained on datasets until the sequences of metric pairs are generated for all datasets acting as the revised feature set. Various experiments have been conducted on 11 NASA and 11 PROMISE repository datasets. Sensitive analysis experiments show that binary classification algorithms based on SDP approaches using the DQN-based feature extraction outperform those without using it. We also conducted experiments to compare our approach with four state-of-the-art approaches on common datasets, which show that our approach is superior to these methods in precision, F-measure, area under receiver operating characteristics curve, and Matthews correlation coefficient values.","M achine learning , software defect prediction, CNN model , deep learning, metrics","","","9"
"Journal Article","Zaidi HZ,Ullah U,Arshad M,Aljuaid H,Rauf MA,Sarwar N,Sajid R","Machine Learning Approaches for Software Defect Prediction","Applied Computational Intelligence and Soft Computing","2025","2025","1","7933078","","","2025","","http://dx.doi.org/10.1155/acis/7933078;https://onlinelibrary.wiley.com/doi/abs/10.1155/acis/7933078","10.1155/acis/7933078","This paper analyses existing research about machine learning approaches in software defect prediction as a key element for improving software reliability and quality. The paper reviews the use of machine learning algorithms in software defect prediction framework’s bug prediction while assessing their performance across multiple environments. A comprehensive review of scholarly literature enables researchers to specify both advantages and drawbacks that emerge when using machine learning for automated defect detection in software defect prediction applications. The review conducts assessments of typical metrics like accuracy and precision and recall and runtime performance yet extends its evaluation to analyze new trends combining deep learning with ensemble approaches to enhance software defect prediction functionality. The examined findings provide crucial guidelines which help developers select and improve machine learning models in software defect prediction processes that result in better software reliability and robustness.","automated defect prediction, machine learning, systematic literature review","","https://onlinelibrary.wiley.com/doi/pdf/10.1155/acis/7933078",""
